{
 "schema": 1,
 "version": "1.3.171",
 "generated": "2026-10-26 08:51 UTC",
 "commands": [
  {
   "name": "add-rules",
   "description": "Create canonical rules for ANY folder — write <folder>/AGENTS.md (from the folder template) + a <folder>/CLAUDE.md @import shim. For folders the stack-map generator doesn't cover.",
   "hint": "<folder> [one-line purpose]",
   "steps": [
    [
     "",
     "Steps"
    ]
   ],
   "scripts": [],
   "noArgs": false,
   "stage": "knowledge",
   "daily": false
  },
  {
   "name": "catchup",
   "description": "Where were we? A quick list of what this session was doing and what is still open",
   "hint": "[name]",
   "steps": [
    [
     "",
     "Read these, in this order, and stop as soon as you can answer"
    ],
    [
     "",
     "What to report"
    ],
    [
     "",
     "Say plainly when the answer is thin"
    ],
    [
     "",
     "When the user wants more than a list"
    ],
    [
     "",
     "Workstreams and open work"
    ]
   ],
   "scripts": [
    "caddis_relay_git.py",
    "caddis_roadmap.py",
    "caddis_workstreams.py"
   ],
   "noArgs": false,
   "stage": "continuity",
   "daily": false
  },
  {
   "name": "cloud-phases",
   "description": "Run plan phases in Claude Code cloud sessions — write one prompt per phase, push, hand out paste lines, then take the PRs back",
   "hint": "[plan path] [phase numbers] | intake",
   "steps": [
    [
     "0",
     "Is this checkout safe to move?"
    ],
    [
     "1",
     "check the preconditions (stop on any failure)"
    ],
    [
     "2",
     "pick the phases for the cloud"
    ],
    [
     "3",
     "check the facts each phase depends on (rule: think before you send)"
    ],
    [
     "4",
     "write one prompt per phase"
    ],
    [
     "",
     "Where you are"
    ],
    [
     "",
     "The phase (copied from the plan)"
    ],
    [
     "",
     "Facts already checked (<date>, at <short SHA>)"
    ],
    [
     "",
     "Edge cases to handle"
    ]
   ],
   "scripts": [
    "caddis_checkout_guard.py",
    "caddis_lanes.py",
    "caddis_todo.py",
    "caddis_worktree_root.py"
   ],
   "noArgs": false,
   "stage": "build",
   "daily": false
  },
  {
   "name": "coordinate",
   "description": "Run this session as the repo's coordinator — one merge queue for all sessions, one merge at a time, a deploy check after each merge, routine approvals in the ledger.",
   "hint": "[start|status|stop]",
   "steps": [
    [
     "",
     "Restart and resume"
    ],
    [
     "",
     "Keep this session cheap"
    ],
    [
     "",
     "How to call the script"
    ],
    [
     "1",
     ". Start (design 0.1)"
    ],
    [
     "2",
     ". Merge mode (design 3, design 12 Q1)"
    ],
    [
     "3",
     ". The loop (design 1, 2, 3, 5, 7)"
    ],
    [
     "4",
     ". Approvals (design 6)"
    ],
    [
     "5",
     ". Failures (design 8) and stalls (design 7.4)"
    ],
    [
     "6",
     ". Stop"
    ]
   ],
   "scripts": [
    "caddis_coordinate.py",
    "caddis_lanes.py"
   ],
   "noArgs": false,
   "stage": "ship",
   "daily": true
  },
  {
   "name": "cross-review",
   "description": "Cross-vendor code review of the current diff — a second-vendor model (agy Argon by default; DeepSeek, GLM or any OpenAI-compatible endpoint) reviews your changes to catch bugs a same-vendor reviewer misses",
   "hint": "[git range, e.g. origin/main..HEAD]",
   "steps": [
    [
     "0",
     "check the key BEFORE reading the diff"
    ],
    [
     "",
     "Run it"
    ],
    [
     "",
     "Interpret the exit code"
    ],
    [
     "",
     "Three rules: one attempt, one review"
    ]
   ],
   "scripts": [
    "caddis_gate.py",
    "oss_review.py"
   ],
   "noArgs": false,
   "stage": "review",
   "daily": false
  },
  {
   "name": "data-lineage",
   "description": "Generate End-to-End Data Lineage and Telemetry Specification Markdown and Confluence XHTML for fleet observability.",
   "hint": "(no arguments — documents the app in this repo)",
   "steps": [],
   "scripts": [
    "convert_doc_to_confluence.py"
   ],
   "noArgs": true,
   "stage": "plan",
   "daily": false
  },
  {
   "name": "decide",
   "description": "Record a decision in one step — .caddis/decisions/<date>-<slug>.md",
   "hint": "<decision>",
   "steps": [
    [
     "1",
     "build the slug"
    ],
    [
     "2",
     "pick the path"
    ],
    [
     "3",
     "write the file"
    ],
    [
     "",
     "Context"
    ],
    [
     "",
     "Decision"
    ],
    [
     "",
     "Consequences"
    ],
    [
     "4",
     "verify"
    ],
    [
     "5",
     "report"
    ]
   ],
   "scripts": [
    "caddis_gate.py"
   ],
   "noArgs": false,
   "stage": "knowledge",
   "daily": false
  },
  {
   "name": "digress",
   "description": "Park the current workstream on the stack and switch to a new task — without losing the original",
   "hint": "[reason for the detour]",
   "steps": [
    [
     "1",
     "identify the CURRENT workstream (the thing being parked)"
    ],
    [
     "2",
     "write a one-line `resumePointer`"
    ],
    [
     "3",
     "write the workstream relay to `.caddis/relay/<name>.md`"
    ],
    [
     "",
     "Current workstream"
    ],
    [
     "",
     "Next step (exact)"
    ],
    [
     "4",
     "confirm, then continue"
    ]
   ],
   "scripts": [],
   "noArgs": false,
   "stage": "continuity",
   "daily": false
  },
  {
   "name": "excalidraw-db",
   "description": "Turn a SQL artifact into an Excalidraw diagram for a design review / ARB pack / slide — higher-level, drag-the-boxes format",
   "hint": "[file path | object name | pasted SQL]",
   "steps": [
    [
     "",
     "Do this"
    ]
   ],
   "scripts": [
    "sql_to_graph.py"
   ],
   "noArgs": false,
   "stage": "knowledge",
   "daily": false
  },
  {
   "name": "feature-plan",
   "description": "Create a phased, TDD-structured implementation plan that acts as the durable spine for multi-session work",
   "hint": "<feature description>",
   "steps": [
    [
     "",
     "Headless mode"
    ],
    [
     "1",
     "Scope check"
    ],
    [
     "2",
     "Design phases"
    ],
    [
     "3",
     "Write the plan to `.caddis/plans/<feature-slug>.md`"
    ],
    [
     "",
     "Goal"
    ],
    [
     "",
     "Current state"
    ],
    [
     "",
     "Constraints & decisions"
    ],
    [
     "",
     "Global Constraints"
    ],
    [
     "",
     "Review Focus"
    ]
   ],
   "scripts": [
    "caddis_gate.py",
    "caddis_lanes.py",
    "caddis_routing.py",
    "caddis_spend.py",
    "caddis_status.py"
   ],
   "noArgs": false,
   "stage": "plan",
   "daily": true
  },
  {
   "name": "fleet-close",
   "description": "Close a fleet of sessions — every session writes its handoff and acks, then print one restart sheet for the owner",
   "hint": "(no arguments — run it in the session that coordinates the close)",
   "steps": [
    [
     "1",
     "list the fleet"
    ],
    [
     "2",
     "make the fleet dir"
    ],
    [
     "3",
     "send the close message"
    ],
    [
     "4",
     "collect acks (first wait: 10 minutes)"
    ],
    [
     "5",
     "remind once (second wait: 20 minutes)"
    ],
    [
     "6",
     "your own handoff and ack"
    ],
    [
     "7",
     "write and check the sheet"
    ],
    [
     "8",
     "final reply"
    ]
   ],
   "scripts": [
    "caddis_fleet.py"
   ],
   "noArgs": true,
   "stage": "continuity",
   "daily": false
  },
  {
   "name": "fleet-open",
   "description": "Restore one role from the fleet restart sheet in a new session — name check, relay, tasks, peer greeting, watchers",
   "hint": "<role> (the Role column of the restart sheet, e.g. containment-build)",
   "steps": [
    [
     "1",
     "find the newest restart sheet that holds the role"
    ],
    [
     "2",
     "check this session's name before loading anything"
    ],
    [
     "3",
     "read the relay and run its resume prompt"
    ],
    [
     "4",
     "greet the live local peers"
    ],
    [
     "5",
     "restart the watchers"
    ],
    [
     "6",
     "record the name and report"
    ]
   ],
   "scripts": [
    "caddis_fleet.py"
   ],
   "noArgs": false,
   "stage": "continuity",
   "daily": false
  },
  {
   "name": "gate-preflight",
   "description": "Deterministic headless preflight — validates a plan against the actual codebase, self-contained (never depends on a skill activating)",
   "hint": "[path to plan.md]",
   "steps": [
    [
     "",
     "HEADLESS RUN RULES (mandatory)"
    ]
   ],
   "scripts": [
    "caddis_todo.py"
   ],
   "noArgs": false,
   "stage": "plan",
   "daily": false
  },
  {
   "name": "gate-review",
   "description": "Deterministic headless code review — adversarial diff review, self-contained (never depends on a skill activating)",
   "hint": "[git range, defaults to the working diff]",
   "steps": [
    [
     "",
     "HEADLESS RUN RULES (mandatory)"
    ]
   ],
   "scripts": [],
   "noArgs": false,
   "stage": "review",
   "daily": false
  },
  {
   "name": "glossary",
   "description": "Define the words this project invented, in one place — .caddis/kb/GLOSSARY.md",
   "hint": "(no arguments — scans this repo for coined terms)",
   "steps": [
    [
     "1",
     "get the candidates"
    ],
    [
     "2",
     "apply the admission test to each candidate"
    ],
    [
     "3",
     "write each definition from the CODE, not from the word"
    ],
    [
     "4",
     "flag what is still dirty"
    ],
    [
     "5",
     "report"
    ],
    [
     "",
     "Keeping it honest"
    ]
   ],
   "scripts": [
    "caddis_glossary.py"
   ],
   "noArgs": true,
   "stage": "knowledge",
   "daily": false
  },
  {
   "name": "handoff",
   "description": "End-of-session handoff — capture exact state so the next session resumes with zero re-discovery",
   "hint": "(no arguments — writes this workstream's relay, .caddis/relay/<name>.md)",
   "steps": [
    [
     "0",
     "is this a shared checkout?"
    ],
    [